{
  "$schema": "https://json-schema.org/draft/2020-12/schema",
  "title": "Phased initiative plan",
  "type": "object",
  "additionalProperties": false,
  "required": [
    "$schema",
    "schemaVersion",
    "id",
    "title",
    "status",
    "updatedAt",
    "phases"
  ],
  "properties": {
    "$schema": {
      "const": "../plan.schema.json"
    },
    "schemaVersion": {
      "enum": [
        1,
        2
      ]
    },
    "id": {
      "type": "string",
      "pattern": "^[a-z][a-z0-9]*(?:-[a-z0-9]+)*$"
    },
    "title": {
      "$ref": "#/$defs/nonBlank"
    },
    "status": {
      "enum": [
        "draft",
        "active",
        "blocked",
        "complete",
        "shelved"
      ]
    },
    "updatedAt": {
      "type": "string",
      "format": "date"
    },
    "activePhase": {
      "oneOf": [
        {
          "type": "null"
        },
        {
          "$ref": "#/$defs/phaseId"
        }
      ]
    },
    "phases": {
      "type": "array",
      "minItems": 1,
      "maxItems": 100,
      "items": {
        "type": "object",
        "additionalProperties": false,
        "required": [
          "id",
          "title",
          "document",
          "status",
          "dependsOn",
          "evidence"
        ],
        "properties": {
          "id": {
            "$ref": "#/$defs/phaseId"
          },
          "title": {
            "$ref": "#/$defs/nonBlank"
          },
          "document": {
            "type": "string",
            "pattern": "^PHASE-[0-9]{2}(?:[a-z]+)?-[a-z][a-z0-9]*(?:-[a-z0-9]+)*\\.md$"
          },
          "status": {
            "enum": [
              "pending",
              "active",
              "blocked",
              "complete"
            ]
          },
          "dependsOn": {
            "type": "array",
            "uniqueItems": true,
            "items": {
              "$ref": "#/$defs/phaseId"
            }
          },
          "evidence": {
            "type": "array",
            "uniqueItems": true,
            "items": {
              "$ref": "#/$defs/nonBlank"
            }
          },
          "type": {
            "enum": [
              "full",
              "outline"
            ],
            "default": "full"
          },
          "epicSlice": {
            "type": "string",
            "pattern": "^[^/\\s][^\\s]*/slice\\.json$",
            "description": "Repository-relative path to this phase's epic slice.json (execution.mode slices). Required once the phase is active, blocked or complete."
          },
          "execution": {
            "enum": [
              "phase-doc",
              "slices"
            ],
            "description": "Override the plan's execution mode for this phase, e.g. phase-doc for phases completed before slices were adopted."
          }
        },
        "allOf": [
          {
            "if": {
              "properties": {
                "status": {
                  "const": "complete"
                }
              }
            },
            "then": {
              "properties": {
                "evidence": {
                  "minItems": 1
                }
              }
            }
          },
          {
            "if": {
              "required": [
                "type"
              ],
              "properties": {
                "type": {
                  "const": "outline"
                }
              }
            },
            "then": {
              "properties": {
                "status": {
                  "const": "pending"
                },
                "evidence": {
                  "maxItems": 0
                }
              }
            }
          }
        ]
      }
    },
    "activePhases": {
      "type": "array",
      "uniqueItems": true,
      "items": {
        "$ref": "#/$defs/phaseId"
      }
    },
    "baseline": {
      "type": "array",
      "items": {
        "type": "object",
        "additionalProperties": false,
        "required": [
          "title",
          "evidence"
        ],
        "properties": {
          "title": {
            "$ref": "#/$defs/nonBlank"
          },
          "evidence": {
            "type": "array",
            "minItems": 1,
            "uniqueItems": true,
            "items": {
              "$ref": "#/$defs/nonBlank"
            }
          }
        }
      }
    },
    "execution": {
      "type": "object",
      "additionalProperties": false,
      "required": [
        "mode"
      ],
      "description": "How phases are executed. Default (omitted) is phase-doc: the phase document's steps are the work. slices: each phase runs through an epic slice and child slices in a slice system (devops-slices format).",
      "properties": {
        "mode": {
          "enum": [
            "phase-doc",
            "slices"
          ]
        },
        "slicesDir": {
          "type": "string",
          "pattern": "\\S",
          "description": "Repository-relative slices directory; informational (default .devops/slices)."
        }
      }
    }
  },
  "$defs": {
    "phaseId": {
      "type": "string",
      "pattern": "^[0-9]{2}(?:[a-z]+)?$",
      "description": "Base phase NN (00\u201399) or insertion NNx (e.g. 06b, 06c) after the base phase."
    },
    "nonBlank": {
      "type": "string",
      "minLength": 1,
      "pattern": "\\S"
    }
  },
  "allOf": [
    {
      "if": {
        "properties": {
          "schemaVersion": {
            "const": 1
          }
        }
      },
      "then": {
        "required": [
          "activePhase"
        ],
        "not": {
          "anyOf": [
            {
              "required": [
                "activePhases"
              ]
            },
            {
              "required": [
                "baseline"
              ]
            }
          ]
        }
      },
      "else": {
        "required": [
          "activePhases"
        ],
        "not": {
          "required": [
            "activePhase"
          ]
        }
      }
    }
  ]
}
